{"candidate_revision":{"artifact_sha256":"0e2578548712f2966b38f7cd7a59dea8b9cd5fb98bac6a52475ae30cb6d4edac","base_sha":"0d459263d4e95688ae8ceae9d758435f603dd57c","candidate_revision":"ec915c1c2ac83fe62f67b8af8a7a25c292c5064d08a595500ddefa22350c4358","snapshot_policy_sha256":"7995940995a161c0b01b077771a5e0dc33cd7286cdf49ec7150f367176196738","tree_sha":"9e3164dedd82934c1fdbb8fa705198803b63fe83"},"command_policy_sha256":"635db1f5ffb1a0ef44a1b7e2a478561cea7226829d894de768ec94ea587b0021","exit_code":0,"findings":[],"finished_at":"2026-08-15T16:58:24Z","gate_id":"gate-gh-900001-ec915c1c2ac83fe6-5","issue_identifier":"GH-900001","job_uid":"b3458e86-e7dc-44b0-a025-109a633a8138","log_sha256":"bcf098cc822e3abf11c25b30e484e4d3fe4b76adcc314ffc748a900f93971bf5","pod_uid":"97791ba7-8f11-4b93-857d-cd181123e835","runner_image":"docker.io/library/jstore-agentic-gate@sha256:30f48b2ef512c0d7be8657637d718f663c8b8eb78843cc5603e10234ee152334","started_at":"2026-08-15T16:50:40Z","verdict":"PASS"}
